{
  "formatVersion" : 1,
  "recording" : {
    "id" : "rec-20261023-155008",
    "name" : "phase2-create-order",
    "seq" : 9
  },
  "trace" : {
    "id" : "t-ca3e4c8f",
    "startedAt" : "2026-10-23T19:50:08.508Z",
    "durationMs" : 52
  },
  "spans" : [ {
    "id" : "s1",
    "depth" : 0,
    "order" : 0,
    "kind" : "EJB",
    "ejb" : {
      "beanClass" : "com.acme.orders.OrderServiceBean",
      "method" : "createOrder",
      "signature" : "com.acme.common.model.Order createOrder(com.acme.common.dto.CreateOrderRequest)"
    },
    "thread" : "[ACTIVE] ExecuteThread: '0' for queue: 'weblogic.kernel.Default (self-tuning)'",
    "args" : [ {
      "declaredType" : "com.acme.common.dto.CreateOrderRequest",
      "value" : {
        "@type" : "com.acme.common.dto.CreateOrderRequest",
        "customer" : {
          "@type" : "com.acme.common.dto.Customer",
          "name" : "Ada Lovelace",
          "email" : "ada@example.com",
          "loyaltyTier" : "GOLD",
          "address" : {
            "@type" : "com.acme.common.dto.Address",
            "street" : "Keizersgracht 1",
            "city" : "Amsterdam",
            "region" : "NH",
            "postalCode" : "1015 CC",
            "country" : "NL"
          }
        },
        "lines" : [ {
          "@type" : "com.acme.common.dto.OrderLineRequest",
          "sku" : "WIDGET-1",
          "quantity" : 3
        }, {
          "@type" : "com.acme.common.dto.OrderLineRequest",
          "sku" : "GADGET-2",
          "quantity" : 1
        } ],
        "attributes" : {
          "channel" : "web",
          "campaign" : "autumn-2026"
        },
        "requestedDeliveryDate" : "2026-10-30",
        "requestedAt" : "2026-10-23T19:50:08.506498989Z",
        "paymentMethod" : {
          "@type" : "com.acme.common.dto.CardPayment",
          "lastFourDigits" : "4242",
          "expiry" : "2028-06"
        }
      }
    } ],
    "result" : {
      "declaredType" : "com.acme.common.model.Order",
      "value" : {
        "@type" : "com.acme.common.model.Order",
        "id" : 17,
        "customerName" : "Ada Lovelace",
        "customerEmail" : "ada@example.com",
        "status" : "CREATED",
        "createdAt" : "2026-10-23T15:50:08.557116",
        "deliveryDate" : "2026-10-30",
        "currency" : "EUR",
        "subtotal" : "123.74",
        "tax" : "25.99",
        "total" : "149.73",
        "paymentSummary" : "card ****4242 exp 2028-06",
        "lines" : {
          "@lazy" : true,
          "loaded" : false
        },
        "audit" : {
          "@unserializable" : "com.acme.common.model.AuditTrail",
          "toString" : "AuditTrail[opened 2026-10-23T19:50:08.559714730Z, 0 chars]"
        }
      }
    },
    "serializationWarnings" : [ {
      "path" : "$.result.audit",
      "reason" : "not java.io.Serializable",
      "typeName" : "com.acme.common.model.AuditTrail"
    } ],
    "startNs" : 0,
    "durationNs" : 52992762
  } ]
}