{
  "formatVersion" : 1,
  "recording" : {
    "id" : "rec-20261023-155008",
    "name" : "phase2-create-order",
    "seq" : 5
  },
  "trace" : {
    "id" : "t-bd875f9e",
    "startedAt" : "2026-10-23T19:50:08.555Z",
    "durationMs" : 0
  },
  "spans" : [ {
    "id" : "s1",
    "depth" : 0,
    "order" : 0,
    "kind" : "EJB",
    "ejb" : {
      "beanClass" : "com.acme.tax.TaxServiceBean",
      "method" : "computeTax",
      "signature" : "com.acme.common.dto.TaxResult computeTax(com.acme.common.dto.TaxRequest)"
    },
    "thread" : "[ACTIVE] ExecuteThread: '0' for queue: 'weblogic.kernel.Default (self-tuning)'",
    "args" : [ {
      "declaredType" : "com.acme.common.dto.TaxRequest",
      "value" : {
        "@type" : "com.acme.common.dto.TaxRequest",
        "country" : "NL",
        "region" : "NH",
        "category" : "GOODS",
        "amount" : "123.74"
      }
    } ],
    "result" : {
      "declaredType" : "com.acme.common.dto.TaxResult",
      "value" : {
        "@type" : "com.acme.common.dto.TaxResult",
        "jurisdiction" : "NL-NH",
        "rate" : "0.21",
        "tax" : "25.99",
        "computedAt" : "2026-10-23T19:50:08.555063684Z"
      }
    },
    "startNs" : 0,
    "durationNs" : 221149
  } ]
}